{
 "schema_version": "3.0",
 "id": "TR-ORDER-009",
 "machine": "SM-ORDER",
 "description": "Schließen mit position=Ticket über bestätigte Menge im Abbau (EXIT_ONLY)",
 "scenarios": [
  "OS-EX-08",
  "OS-RI-03"
 ],
 "start": "PERSISTED",
 "initial_reasons": null,
 "steps": [
  {
   "event": "SEND_STARTED",
   "context": {
    "writer_state": "ACTIVE_WRITER",
    "lease_age_s": 3,
    "permission": "CLOSE_REDUCE",
    "allowed_actions": [
     "CANCEL_ORDER",
     "CLOSE_REDUCE",
     "EMERGENCY_PROTECT",
     "RECONCILE",
     "ROLL_AS_CLOSE",
     "STOP_AMEND_RECONCILED_ONLY"
    ],
    "order_kind": "CLOSE",
    "has_position_ticket": true,
    "qty_le_confirmed": true,
    "snapshot_age_s": 20
   },
   "expect_state": "SUBMITTING"
  },
  {
   "event": "FILL_COMPLETE",
   "context": {},
   "expect_state": "FILLED"
  }
 ]
}
